{
  "$schema": "../../schema/jumptable.schema.json",
  "id": "x64/coreutils-9.9-clang-pie-o2-df",
  "arch": "x64",
  "compiler": "clang",
  "optLevel": "O2",
  "imageBase": "0x0",
  "jumpTables": [
    {
      "insAddr": "0x3bf6",
      "tableAddress": "0x11004",
      "jumpBase": "0x11004",
      "entrySize": 4,
      "numEntries": 133,
      "targets": [
        "0x3ba7",
        "0x3bc0",
        "0x3bf9",
        "0x3c29",
        "0x3c7f",
        "0x3c8b",
        "0x3c97",
        "0x3cab",
        "0x3cc7",
        "0x3ce1",
        "0x3d0b",
        "0x3d24",
        "0x3d57",
        "0x3d63",
        "0x3d7d",
        "0x3d97",
        "0x3da3",
        "0x3daf",
        "0x5aa8"
      ],
      "kind": "switch",
      "confidence": "exact"
    },
    {
      "insAddr": "0x40de",
      "tableAddress": "0x11218",
      "jumpBase": "0x11218",
      "entrySize": 4,
      "numEntries": 5,
      "targets": [
        "0x40e1",
        "0x4361",
        "0x437b",
        "0x465b",
        "0x54fe"
      ],
      "kind": "switch",
      "confidence": "exact"
    },
    {
      "insAddr": "0x6375",
      "tableAddress": "0x1122c",
      "jumpBase": "0x1122c",
      "entrySize": 4,
      "numEntries": 12,
      "targets": [
        "0x6378",
        "0x63a7",
        "0x63b6",
        "0x641e",
        "0x64a6",
        "0x64b0",
        "0x64ba",
        "0x64c4"
      ],
      "kind": "switch",
      "confidence": "exact"
    },
    {
      "insAddr": "0x6db8",
      "tableAddress": "0x12158",
      "jumpBase": "0x12158",
      "entrySize": 4,
      "numEntries": 94,
      "targets": [
        "0x6dbb",
        "0x6dbc"
      ],
      "kind": "switch",
      "confidence": "exact"
    },
    {
      "insAddr": "0xa9a4",
      "tableAddress": "0x12510",
      "jumpBase": "0x12510",
      "entrySize": 4,
      "numEntries": 11,
      "targets": [
        "0xa9a7",
        "0xaa4c",
        "0xaaab",
        "0xaaca",
        "0xaad3",
        "0xaad5",
        "0xaad7",
        "0xaae5",
        "0xab32",
        "0xb4a2"
      ],
      "kind": "switch",
      "confidence": "exact"
    },
    {
      "insAddr": "0xac6d",
      "tableAddress": "0x1253c",
      "jumpBase": "0x1253c",
      "entrySize": 4,
      "numEntries": 127,
      "targets": [
        "0xac71",
        "0xad01",
        "0xad2a",
        "0xad38",
        "0xad3b",
        "0xad50",
        "0xad73",
        "0xad7a",
        "0xad7f",
        "0xad86",
        "0xad89",
        "0xad9c",
        "0xae70",
        "0xaea3",
        "0xaeaa",
        "0xaf3b",
        "0xafb4"
      ],
      "kind": "switch",
      "confidence": "exact"
    },
    {
      "insAddr": "0xc0eb",
      "tableAddress": "0x127bc",
      "jumpBase": "0x127bc",
      "entrySize": 4,
      "numEntries": 10,
      "targets": [
        "0xc0ee",
        "0xc112",
        "0xc131",
        "0xc165",
        "0xc18d",
        "0xc1b9",
        "0xc1e3",
        "0xc203",
        "0xc25a",
        "0xc297"
      ],
      "kind": "switch",
      "confidence": "exact"
    },
    {
      "insAddr": "0xccc2",
      "tableAddress": "0x12b80",
      "jumpBase": "0x12b80",
      "entrySize": 4,
      "numEntries": 54,
      "targets": [
        "0xccc5",
        "0xcd0a",
        "0xcd24",
        "0xcd83",
        "0xcda6",
        "0xcdeb",
        "0xce04",
        "0xce49",
        "0xced0",
        "0xcee0",
        "0xcf8c",
        "0xd02a",
        "0xd09a",
        "0xd0b8",
        "0xd0d8"
      ],
      "kind": "switch",
      "confidence": "exact"
    },
    {
      "insAddr": "0xd1ea",
      "tableAddress": "0x12c58",
      "jumpBase": "0x12c58",
      "entrySize": 4,
      "numEntries": 24,
      "targets": [
        "0xd1c4",
        "0xd1ed",
        "0xd22c",
        "0xd24c",
        "0xd26a",
        "0xd285",
        "0xd294"
      ],
      "kind": "switch",
      "confidence": "exact"
    },
    {
      "insAddr": "0xecf8",
      "tableAddress": "0x12e0c",
      "jumpBase": "0x12e0c",
      "entrySize": 4,
      "numEntries": 33,
      "targets": [
        "0xecfb",
        "0xed47",
        "0xedae",
        "0xedc8",
        "0xede2",
        "0xedfc",
        "0xef98",
        "0xefe6"
      ],
      "kind": "switch",
      "confidence": "exact"
    },
    {
      "insAddr": "0x1005c",
      "tableAddress": "0x12e90",
      "jumpBase": "0x12e90",
      "entrySize": 4,
      "numEntries": 47,
      "targets": [
        "0x10060",
        "0x10079",
        "0x10092",
        "0x100ab",
        "0x10106",
        "0x10124",
        "0x10141",
        "0x1015a",
        "0x101ce"
      ],
      "kind": "switch",
      "confidence": "exact"
    },
    {
      "insAddr": "0x103cc",
      "tableAddress": "0x12f74",
      "jumpBase": "0x12f74",
      "entrySize": 4,
      "numEntries": 42,
      "targets": [
        "0x10392",
        "0x103a0",
        "0x103cf",
        "0x103d6",
        "0x103dd",
        "0x103e4",
        "0x103eb",
        "0x10400",
        "0x104a0"
      ],
      "kind": "switch",
      "confidence": "exact"
    },
    {
      "insAddr": "0x107cf",
      "tableAddress": "0x1301c",
      "jumpBase": "0x1301c",
      "entrySize": 4,
      "numEntries": 47,
      "targets": [
        "0x107d2",
        "0x10811",
        "0x10833",
        "0x10849",
        "0x1088c",
        "0x108a5"
      ],
      "kind": "switch",
      "confidence": "exact"
    },
    {
      "insAddr": "0x1086b",
      "tableAddress": "0x130d8",
      "jumpBase": "0x130d8",
      "entrySize": 4,
      "numEntries": 8,
      "targets": [
        "0x1086e",
        "0x108a0",
        "0x10db3",
        "0x10dd0",
        "0x10de5"
      ],
      "kind": "switch",
      "confidence": "exact"
    },
    {
      "insAddr": "0x108c3",
      "tableAddress": "0x13118",
      "jumpBase": "0x13118",
      "entrySize": 4,
      "numEntries": 84,
      "targets": [
        "0x108c6",
        "0x108ca",
        "0x108cc",
        "0x10a8c",
        "0x10bf8",
        "0x10c05",
        "0x10c13",
        "0x10c1d",
        "0x10c2a",
        "0x10eb7"
      ],
      "kind": "switch",
      "confidence": "exact"
    },
    {
      "insAddr": "0x10d93",
      "tableAddress": "0x130f8",
      "jumpBase": "0x130f8",
      "entrySize": 4,
      "numEntries": 8,
      "targets": [
        "0x108a0",
        "0x10d96",
        "0x10e02",
        "0x10e1f",
        "0x10e3c"
      ],
      "kind": "switch",
      "confidence": "exact"
    }
  ]
}
