{
  "$schema": "../../schema/jumptable.schema.json",
  "id": "x64/coreutils-9.9-clang-pie-o2-ls",
  "arch": "x64",
  "compiler": "clang",
  "optLevel": "O2",
  "imageBase": "0x0",
  "jumpTables": [
    {
      "insAddr": "0x4b36",
      "tableAddress": "0x19010",
      "jumpBase": "0x19010",
      "entrySize": 4,
      "numEntries": 277,
      "targets": [
        "0x4b39",
        "0x4b4c",
        "0x4b9c",
        "0x4bf5",
        "0x4c45",
        "0x4c59",
        "0x4c9e",
        "0x4caa",
        "0x4cb9",
        "0x4d09",
        "0x4d22",
        "0x4d2f",
        "0x4d5d",
        "0x4d69",
        "0x4d7d",
        "0x4d89",
        "0x4d90",
        "0x4d9d",
        "0x4dec",
        "0x4e00",
        "0x4e0c",
        "0x4e5e",
        "0x4e77",
        "0x4e84",
        "0x4e90",
        "0x4ea6",
        "0x4eb2",
        "0x4ecd",
        "0x4eda",
        "0x4ee6",
        "0x4f25",
        "0x4f34",
        "0x4f43",
        "0x4f52",
        "0x4f5f",
        "0x4f6b",
        "0x4ff8",
        "0x502b",
        "0x5037",
        "0x5044",
        "0x50c2",
        "0x50cf",
        "0x50de",
        "0x50e8",
        "0x50f5",
        "0x5102",
        "0x510f",
        "0x513e",
        "0x5182",
        "0x518f",
        "0x519e",
        "0x51b4",
        "0x51c1",
        "0x51ce",
        "0x51dd",
        "0x51ea",
        "0x5272",
        "0x52e2",
        "0x52e9",
        "0x735d",
        "0x7364",
        "0x73f0"
      ],
      "kind": "switch",
      "confidence": "exact"
    },
    {
      "insAddr": "0x58ae",
      "tableAddress": "0x19464",
      "jumpBase": "0x19464",
      "entrySize": 4,
      "numEntries": 4,
      "targets": [
        "0x58b1",
        "0x58e8",
        "0x5906",
        "0x5912"
      ],
      "kind": "switch",
      "confidence": "exact"
    },
    {
      "insAddr": "0x5d83",
      "tableAddress": "0x19474",
      "jumpBase": "0x19474",
      "entrySize": 4,
      "numEntries": 6,
      "targets": [
        "0x5d86",
        "0x5dd0",
        "0x5e50",
        "0x5eb0",
        "0x6041",
        "0x7438"
      ],
      "kind": "switch",
      "confidence": "exact"
    },
    {
      "insAddr": "0x8c5f",
      "tableAddress": "0x1948c",
      "jumpBase": "0x1948c",
      "entrySize": 4,
      "numEntries": 5,
      "targets": [
        "0x8c62",
        "0x97e4",
        "0x97ee",
        "0x982a",
        "0x9a8e"
      ],
      "kind": "switch",
      "confidence": "exact"
    },
    {
      "insAddr": "0x8d7c",
      "tableAddress": "0x194a0",
      "jumpBase": "0x194a0",
      "entrySize": 4,
      "numEntries": 4,
      "targets": [
        "0x8d7f",
        "0x8d90",
        "0x8da0",
        "0x8dc0"
      ],
      "kind": "switch",
      "confidence": "exact"
    },
    {
      "insAddr": "0xa6a3",
      "tableAddress": "0x194b0",
      "jumpBase": "0x194b0",
      "entrySize": 4,
      "numEntries": 5,
      "targets": [
        "0xa6a7",
        "0xa6d4",
        "0xa6f1",
        "0xa715",
        "0xa763"
      ],
      "kind": "switch",
      "confidence": "exact"
    },
    {
      "insAddr": "0xa6c1",
      "tableAddress": "0x196a8",
      "jumpBase": "0x196a8",
      "entrySize": 4,
      "numEntries": 37,
      "targets": [
        "0xa6c4",
        "0xa7d3",
        "0xa7e0",
        "0xa7f1",
        "0xa854"
      ],
      "kind": "switch",
      "confidence": "exact"
    },
    {
      "insAddr": "0xa780",
      "tableAddress": "0x194c4",
      "jumpBase": "0x194c4",
      "entrySize": 4,
      "numEntries": 121,
      "targets": [
        "0xa783",
        "0xa7fc",
        "0xa801",
        "0xa806",
        "0xa80b",
        "0xa810",
        "0xa815",
        "0xa81a",
        "0xa81f",
        "0xa829",
        "0xa82e",
        "0xa833",
        "0xa836",
        "0xa844"
      ],
      "kind": "switch",
      "confidence": "exact"
    },
    {
      "insAddr": "0xb062",
      "tableAddress": "0x1973c",
      "jumpBase": "0x1973c",
      "entrySize": 4,
      "numEntries": 95,
      "targets": [
        "0xb065",
        "0xb07b"
      ],
      "kind": "switch",
      "confidence": "exact"
    },
    {
      "insAddr": "0xd92c",
      "tableAddress": "0x198b8",
      "jumpBase": "0x198b8",
      "entrySize": 4,
      "numEntries": 12,
      "targets": [
        "0xd92f",
        "0xda37",
        "0xda72",
        "0xda8b",
        "0xda95",
        "0xdae3",
        "0xdaed",
        "0xdcb3"
      ],
      "kind": "switch",
      "confidence": "exact"
    },
    {
      "insAddr": "0xedd8",
      "tableAddress": "0x1d9e0",
      "jumpBase": "0x1d9e0",
      "entrySize": 4,
      "numEntries": 94,
      "targets": [
        "0xeddb",
        "0xeddc"
      ],
      "kind": "switch",
      "confidence": "exact"
    },
    {
      "insAddr": "0x13160",
      "tableAddress": "0x1dd70",
      "jumpBase": "0x1dd70",
      "entrySize": 4,
      "numEntries": 14,
      "targets": [
        "0x13140",
        "0x13163",
        "0x13190",
        "0x13197",
        "0x13210"
      ],
      "kind": "switch",
      "confidence": "exact"
    },
    {
      "insAddr": "0x132b6",
      "tableAddress": "0x1dda8",
      "jumpBase": "0x1dda8",
      "entrySize": 4,
      "numEntries": 123,
      "targets": [
        "0x132b9",
        "0x133dc",
        "0x135ba",
        "0x135da",
        "0x13601",
        "0x13702",
        "0x13726",
        "0x13754",
        "0x1378e",
        "0x1392f",
        "0x13949",
        "0x13959",
        "0x13974",
        "0x139a3",
        "0x139e9",
        "0x139f5",
        "0x13a1b",
        "0x13a4c",
        "0x13ac7",
        "0x13ad7",
        "0x13b3a",
        "0x13b47",
        "0x13b4f",
        "0x13b80",
        "0x13bc0",
        "0x13be4",
        "0x13c26",
        "0x13c29",
        "0x13c45",
        "0x13cc0",
        "0x13e93",
        "0x13ea3",
        "0x13eb3",
        "0x13ec3",
        "0x13ed2",
        "0x13ffd",
        "0x14018",
        "0x14033",
        "0x14054",
        "0x14207",
        "0x14210",
        "0x143e9",
        "0x148a8"
      ],
      "kind": "switch",
      "confidence": "exact"
    },
    {
      "insAddr": "0x14761",
      "tableAddress": "0x1df94",
      "jumpBase": "0x1df94",
      "entrySize": 4,
      "numEntries": 4,
      "targets": [
        "0x14765",
        "0x1505b",
        "0x15063",
        "0x15187"
      ],
      "kind": "switch",
      "confidence": "exact"
    },
    {
      "insAddr": "0x15c14",
      "tableAddress": "0x1e2f0",
      "jumpBase": "0x1e2f0",
      "entrySize": 4,
      "numEntries": 11,
      "targets": [
        "0x15c17",
        "0x15cbc",
        "0x15d1b",
        "0x15d3a",
        "0x15d43",
        "0x15d45",
        "0x15d47",
        "0x15d55",
        "0x15da2",
        "0x16712"
      ],
      "kind": "switch",
      "confidence": "exact"
    },
    {
      "insAddr": "0x15edd",
      "tableAddress": "0x1e31c",
      "jumpBase": "0x1e31c",
      "entrySize": 4,
      "numEntries": 127,
      "targets": [
        "0x15ee1",
        "0x15f71",
        "0x15f9a",
        "0x15fa8",
        "0x15fab",
        "0x15fc0",
        "0x15fe3",
        "0x15fea",
        "0x15fef",
        "0x15ff6",
        "0x15ff9",
        "0x1600c",
        "0x160e0",
        "0x16113",
        "0x1611a",
        "0x161ab",
        "0x16224"
      ],
      "kind": "switch",
      "confidence": "exact"
    },
    {
      "insAddr": "0x179cb",
      "tableAddress": "0x1e598",
      "jumpBase": "0x1e598",
      "entrySize": 4,
      "numEntries": 10,
      "targets": [
        "0x179ce",
        "0x179f2",
        "0x17a11",
        "0x17a45",
        "0x17a6d",
        "0x17a99",
        "0x17ac3",
        "0x17ae3",
        "0x17b3a",
        "0x17b77"
      ],
      "kind": "switch",
      "confidence": "exact"
    },
    {
      "insAddr": "0x18852",
      "tableAddress": "0x1e950",
      "jumpBase": "0x1e950",
      "entrySize": 4,
      "numEntries": 54,
      "targets": [
        "0x18855",
        "0x1889a",
        "0x188b4",
        "0x18913",
        "0x18936",
        "0x1897b",
        "0x18994",
        "0x189d9",
        "0x18a60",
        "0x18a70",
        "0x18b1c",
        "0x18bba",
        "0x18c2a",
        "0x18c48",
        "0x18c68"
      ],
      "kind": "switch",
      "confidence": "exact"
    }
  ]
}
