{
  "$schema": "../../schema/jumptable.schema.json",
  "id": "x86-clang/coreutils-9.9-clang-pie-o2-env",
  "arch": "x86",
  "compiler": "clang",
  "optLevel": "O2",
  "imageBase": "0x0",
  "jumpTables": [
    {
      "insAddr": "0x1a4c",
      "tableAddress": "0x7008",
      "jumpBase": "0xd000",
      "entrySize": 4,
      "numEntries": 133,
      "targets": [
        "0x1a08",
        "0x1a17",
        "0x1a4f",
        "0x1a57",
        "0x1a6b",
        "0x1a79",
        "0x1a87",
        "0x1ad9",
        "0x1ae5",
        "0x1f39",
        "0x1f4d",
        "0x21a4",
        "0x295a",
        "0x29a0"
      ],
      "kind": "switch",
      "confidence": "exact"
    },
    {
      "insAddr": "0x1b84",
      "tableAddress": "0x721c",
      "jumpBase": "0xd000",
      "entrySize": 4,
      "numEntries": 93,
      "targets": [
        "0x1b87",
        "0x1b93",
        "0x1ba7",
        "0x1bb6",
        "0x1bc5",
        "0x1bf6",
        "0x1c09",
        "0x1f75"
      ],
      "kind": "switch",
      "confidence": "exact"
    },
    {
      "insAddr": "0x1c8d",
      "tableAddress": "0x7390",
      "jumpBase": "0xd000",
      "entrySize": 4,
      "numEntries": 119,
      "targets": [
        "0x1c09",
        "0x1c90",
        "0x1c9d",
        "0x1ca1",
        "0x1cb9",
        "0x1cbd",
        "0x1cc1",
        "0x218b",
        "0x2a4c",
        "0x2a59"
      ],
      "kind": "switch",
      "confidence": "exact"
    },
    {
      "insAddr": "0x31a1",
      "tableAddress": "0x8158",
      "jumpBase": "0xd000",
      "entrySize": 4,
      "numEntries": 94,
      "targets": [
        "0x31a4",
        "0x31a5"
      ],
      "kind": "switch",
      "confidence": "exact"
    },
    {
      "insAddr": "0x37d7",
      "tableAddress": "0x8314",
      "jumpBase": "0xd000",
      "entrySize": 4,
      "numEntries": 11,
      "targets": [
        "0x37da",
        "0x387a",
        "0x38eb",
        "0x390c",
        "0x3914",
        "0x3916",
        "0x391c",
        "0x392c",
        "0x3970",
        "0x4313"
      ],
      "kind": "switch",
      "confidence": "exact"
    },
    {
      "insAddr": "0x3aeb",
      "tableAddress": "0x8340",
      "jumpBase": "0xd000",
      "entrySize": 4,
      "numEntries": 127,
      "targets": [
        "0x3aee",
        "0x3ba0",
        "0x3bd2",
        "0x3be1",
        "0x3be3",
        "0x3bf7",
        "0x3c1c",
        "0x3c23",
        "0x3c27",
        "0x3c2e",
        "0x3c30",
        "0x3c42",
        "0x3cb1",
        "0x3ce5",
        "0x3cec",
        "0x3d6f",
        "0x3dd5"
      ],
      "kind": "switch",
      "confidence": "exact"
    },
    {
      "insAddr": "0x41e7",
      "tableAddress": "0x853c",
      "jumpBase": "0xd000",
      "entrySize": 4,
      "numEntries": 34,
      "targets": [
        "0x41c3",
        "0x43d4"
      ],
      "kind": "switch",
      "confidence": "exact"
    },
    {
      "insAddr": "0x522b",
      "tableAddress": "0x8654",
      "jumpBase": "0xd000",
      "entrySize": 4,
      "numEntries": 10,
      "targets": [
        "0x522e",
        "0x5236",
        "0x524d",
        "0x5274",
        "0x527f",
        "0x5297",
        "0x52c3",
        "0x52dd",
        "0x530f",
        "0x5355"
      ],
      "kind": "switch",
      "confidence": "exact"
    }
  ]
}
