{
  "$schema": "../../schema/jumptable.schema.json",
  "id": "x86/coreutils-9.9-clang-pie-o2-users",
  "arch": "x86",
  "compiler": "clang",
  "optLevel": "O2",
  "imageBase": "0x0",
  "jumpTables": [
    {
      "insAddr": "0x21b7",
      "tableAddress": "0x62ac",
      "jumpBase": "0xa000",
      "entrySize": 4,
      "numEntries": 11,
      "targets": [
        "0x21ba",
        "0x225a",
        "0x22cb",
        "0x22ec",
        "0x22f4",
        "0x22f6",
        "0x22fc",
        "0x230c",
        "0x2350",
        "0x2cf3"
      ],
      "kind": "switch",
      "confidence": "exact"
    },
    {
      "insAddr": "0x24cb",
      "tableAddress": "0x62d8",
      "jumpBase": "0xa000",
      "entrySize": 4,
      "numEntries": 127,
      "targets": [
        "0x24ce",
        "0x2580",
        "0x25b2",
        "0x25c1",
        "0x25c3",
        "0x25d7",
        "0x25fc",
        "0x2603",
        "0x2607",
        "0x260e",
        "0x2610",
        "0x2622",
        "0x2691",
        "0x26c5",
        "0x26cc",
        "0x274f",
        "0x27b5"
      ],
      "kind": "switch",
      "confidence": "exact"
    },
    {
      "insAddr": "0x2bc7",
      "tableAddress": "0x64d4",
      "jumpBase": "0xa000",
      "entrySize": 4,
      "numEntries": 34,
      "targets": [
        "0x2ba3",
        "0x2db4"
      ],
      "kind": "switch",
      "confidence": "exact"
    },
    {
      "insAddr": "0x471b",
      "tableAddress": "0x6650",
      "jumpBase": "0xa000",
      "entrySize": 4,
      "numEntries": 10,
      "targets": [
        "0x471e",
        "0x4726",
        "0x473d",
        "0x4764",
        "0x476f",
        "0x4787",
        "0x47b3",
        "0x47cd",
        "0x47ff",
        "0x4845"
      ],
      "kind": "switch",
      "confidence": "exact"
    },
    {
      "insAddr": "0x51ae",
      "tableAddress": "0x699c",
      "jumpBase": "0xa000",
      "entrySize": 4,
      "numEntries": 24,
      "targets": [
        "0x51b1",
        "0x51ee",
        "0x520c",
        "0x5216",
        "0x5233",
        "0x5248",
        "0x5262"
      ],
      "kind": "switch",
      "confidence": "exact"
    }
  ]
}
