{
  "$schema": "../../schema/jumptable.schema.json",
  "id": "x64/coreutils-8.30-gcc-pie-o2-date",
  "arch": "x64",
  "compiler": "gcc",
  "optLevel": "O2",
  "imageBase": "0x0",
  "jumpTables": [
    {
      "insAddr": "0x43a9",
      "tableAddress": "0x12b30",
      "jumpBase": "0x12b30",
      "entrySize": 4,
      "numEntries": 123,
      "targets": [
        "0x4420",
        "0x4530",
        "0x453a",
        "0x4678",
        "0x46b1",
        "0x474d",
        "0x47ce",
        "0x47e5",
        "0x4831",
        "0x48cd",
        "0x4afb",
        "0x4b13",
        "0x4cdb",
        "0x4ce5",
        "0x4d65",
        "0x4d7e",
        "0x4d8f",
        "0x4dc5",
        "0x4df9",
        "0x4e09",
        "0x4e32",
        "0x4ec0",
        "0x4eda",
        "0x4ef4",
        "0x5080",
        "0x509a",
        "0x50f0",
        "0x51e0",
        "0x5204",
        "0x520c",
        "0x5226",
        "0x523a",
        "0x5281",
        "0x52c8",
        "0x52e5",
        "0x53e5",
        "0x5431",
        "0x545a",
        "0x5473",
        "0x548d"
      ],
      "kind": "switch",
      "confidence": "exact"
    },
    {
      "insAddr": "0x6dbe",
      "tableAddress": "0x13b20",
      "jumpBase": "0x13b20",
      "entrySize": 4,
      "numEntries": 88,
      "targets": [
        "0x6dc0",
        "0x6f00",
        "0x70fb",
        "0x75c1",
        "0x7604",
        "0x7646",
        "0x7689",
        "0x776b",
        "0x77ad",
        "0x77ef",
        "0x780d",
        "0x7819",
        "0x788e",
        "0x78a4",
        "0x7933",
        "0x7948",
        "0x7969",
        "0x79ab",
        "0x7a1c",
        "0x7a41",
        "0x7a71",
        "0x7ab0",
        "0x7ab9",
        "0x7acd",
        "0x7b0f",
        "0x7b23",
        "0x7b70",
        "0x7b84",
        "0x7c00",
        "0x7c45",
        "0x7c51",
        "0x7c65",
        "0x7caa",
        "0x7d00",
        "0x7d15",
        "0x7d40",
        "0x7d68",
        "0x7d7d",
        "0x7dc8",
        "0x7e00",
        "0x7e14",
        "0x7e31",
        "0x7e4e",
        "0x7e63",
        "0x7e78",
        "0x7e8a",
        "0x7e9c",
        "0x7f10",
        "0x7f1d",
        "0x7f2a",
        "0x7f37",
        "0x7f4c",
        "0x7f59",
        "0x7fb0",
        "0x7fe3",
        "0x8013",
        "0x8040",
        "0x8073",
        "0x80a3",
        "0x80d0",
        "0x8126",
        "0x817c",
        "0x819c",
        "0x81c4",
        "0x81ec",
        "0x8214"
      ],
      "kind": "switch",
      "confidence": "exact"
    },
    {
      "insAddr": "0xac21",
      "tableAddress": "0x14200",
      "jumpBase": "0x14200",
      "entrySize": 4,
      "numEntries": 11,
      "targets": [
        "0xac23",
        "0xb7f4",
        "0xb850",
        "0xb8a5",
        "0xb8ea",
        "0xb924",
        "0xb9ca",
        "0xba04",
        "0xbbf8"
      ],
      "kind": "switch",
      "confidence": "exact"
    },
    {
      "insAddr": "0xad7e",
      "tableAddress": "0x1422c",
      "jumpBase": "0x1422c",
      "entrySize": 4,
      "numEntries": 127,
      "targets": [
        "0xad83",
        "0xae53",
        "0xae83",
        "0xaea8",
        "0xaee8",
        "0xaef8",
        "0xafa0",
        "0xafc8",
        "0xafe0",
        "0xaff0",
        "0xb020",
        "0xb030",
        "0xb040",
        "0xb050",
        "0xb060",
        "0xb070",
        "0xb088"
      ],
      "kind": "switch",
      "confidence": "exact"
    },
    {
      "insAddr": "0xb10a",
      "tableAddress": "0x14428",
      "jumpBase": "0x14428",
      "entrySize": 4,
      "numEntries": 127,
      "targets": [
        "0xad80",
        "0xae50",
        "0xae80",
        "0xb080",
        "0xb110",
        "0xb130",
        "0xb148",
        "0xb160",
        "0xb170",
        "0xb210",
        "0xb228",
        "0xb240",
        "0xb258",
        "0xb270",
        "0xb288",
        "0xb298",
        "0xb2b0"
      ],
      "kind": "switch",
      "confidence": "exact"
    },
    {
      "insAddr": "0xc814",
      "tableAddress": "0x14968",
      "jumpBase": "0x14968",
      "entrySize": 4,
      "numEntries": 10,
      "targets": [
        "0xc840",
        "0xc8c8",
        "0xc920",
        "0xc960",
        "0xc9a0",
        "0xc9f0",
        "0xca48",
        "0xca78",
        "0xcae0",
        "0xcb77"
      ],
      "kind": "switch",
      "confidence": "exact"
    },
    {
      "insAddr": "0xdb71",
      "tableAddress": "0x149ec",
      "jumpBase": "0x149ec",
      "entrySize": 4,
      "numEntries": 123,
      "targets": [
        "0xdb90",
        "0xdcc0",
        "0xdcc9",
        "0xdded",
        "0xde24",
        "0xdeaf",
        "0xdf15",
        "0xdf2e",
        "0xdf8c",
        "0xdfa5",
        "0xdfbe",
        "0xdffe",
        "0xe08b",
        "0xe0aa",
        "0xe102",
        "0xe177",
        "0xe1b5",
        "0xe357",
        "0xe450",
        "0xe461",
        "0xe486",
        "0xe66f",
        "0xe687",
        "0xe6a3",
        "0xe6ef",
        "0xe70a",
        "0xe88f",
        "0xe8ab",
        "0xe985",
        "0xe9bf",
        "0xe9ea",
        "0xea38",
        "0xea5b",
        "0xea63",
        "0xea7f",
        "0xeaaa",
        "0xeb1d",
        "0xeb24",
        "0xeb54",
        "0xeb6a"
      ],
      "kind": "switch",
      "confidence": "exact"
    },
    {
      "insAddr": "0xf84b",
      "tableAddress": "0x14bd8",
      "jumpBase": "0x14bd8",
      "entrySize": 4,
      "numEntries": 18,
      "targets": [
        "0x10216",
        "0xf850",
        "0xf988",
        "0xfab0",
        "0xfb38",
        "0xfbb8",
        "0xfbf8",
        "0xfc80",
        "0xfcb0"
      ],
      "kind": "switch",
      "confidence": "exact"
    },
    {
      "insAddr": "0xfdf0",
      "tableAddress": "0x14c20",
      "jumpBase": "0x14c20",
      "entrySize": 4,
      "numEntries": 5,
      "targets": [
        "0x10060",
        "0x10070",
        "0x10080",
        "0xff30"
      ],
      "kind": "switch",
      "confidence": "exact"
    },
    {
      "insAddr": "0x10446",
      "tableAddress": "0x14c40",
      "jumpBase": "0x14c40",
      "entrySize": 4,
      "numEntries": 23,
      "targets": [
        "0x10450",
        "0x10480",
        "0x10486",
        "0x104aa",
        "0x104cc",
        "0x104ee",
        "0x10514",
        "0x10542",
        "0x10570"
      ],
      "kind": "switch",
      "confidence": "exact"
    },
    {
      "insAddr": "0x10855",
      "tableAddress": "0x14cbc",
      "jumpBase": "0x14cbc",
      "entrySize": 4,
      "numEntries": 84,
      "targets": [
        "0x10857",
        "0x108cb",
        "0x10d0c",
        "0x10d58",
        "0x10d6b",
        "0x10db8",
        "0x10dcb",
        "0x10dec",
        "0x10dfc",
        "0x10e50",
        "0x10e5b"
      ],
      "kind": "switch",
      "confidence": "exact"
    }
  ]
}
