{
  "$schema": "../../schema/jumptable.schema.json",
  "id": "x64/coreutils-9.9-gcc-pie-o2-nice",
  "arch": "x64",
  "compiler": "gcc",
  "optLevel": "O2",
  "imageBase": "0x0",
  "jumpTables": [
    {
      "insAddr": "0x302e",
      "tableAddress": "0x7640",
      "jumpBase": "0x7640",
      "entrySize": 4,
      "numEntries": 11,
      "targets": [
        "0x3030",
        "0x30bd",
        "0x35c8",
        "0x3627",
        "0x366e",
        "0x36b0",
        "0x3707",
        "0x371c",
        "0x3749"
      ],
      "kind": "switch",
      "confidence": "exact"
    },
    {
      "insAddr": "0x3168",
      "tableAddress": "0x766c",
      "jumpBase": "0x766c",
      "entrySize": 4,
      "numEntries": 36,
      "targets": [
        "0x3180",
        "0x3380",
        "0x33b0",
        "0x3400",
        "0x3438",
        "0x3478",
        "0x34b0",
        "0x3530",
        "0x3550",
        "0x3568",
        "0x3580",
        "0x35b8"
      ],
      "kind": "switch",
      "confidence": "exact"
    },
    {
      "insAddr": "0x38fa",
      "tableAddress": "0x76fc",
      "jumpBase": "0x76fc",
      "entrySize": 4,
      "numEntries": 36,
      "targets": [
        "0x3900",
        "0x3a48",
        "0x3a55",
        "0x3a6a",
        "0x3a7a",
        "0x3a8f",
        "0x3ac1",
        "0x3b38",
        "0x3b71",
        "0x3b83",
        "0x3b9f",
        "0x3bb4"
      ],
      "kind": "switch",
      "confidence": "exact"
    },
    {
      "insAddr": "0x3bfb",
      "tableAddress": "0x778c",
      "jumpBase": "0x778c",
      "entrySize": 4,
      "numEntries": 36,
      "targets": [
        "0x3180",
        "0x3380",
        "0x3c00",
        "0x3c89",
        "0x3cb7",
        "0x3cce",
        "0x3ce0",
        "0x3cf7",
        "0x3d06",
        "0x3d0e",
        "0x3d20",
        "0x3d2d"
      ],
      "kind": "switch",
      "confidence": "exact"
    },
    {
      "insAddr": "0x5504",
      "tableAddress": "0x7b80",
      "jumpBase": "0x7b80",
      "entrySize": 4,
      "numEntries": 10,
      "targets": [
        "0x5510",
        "0x5548",
        "0x5570",
        "0x55a0",
        "0x55c0",
        "0x55e8",
        "0x5610",
        "0x5640",
        "0x5660",
        "0x56a0"
      ],
      "kind": "switch",
      "confidence": "exact"
    },
    {
      "insAddr": "0x5efe",
      "tableAddress": "0x7c00",
      "jumpBase": "0x7c00",
      "entrySize": 4,
      "numEntries": 54,
      "targets": [
        "0x5f27",
        "0x5f34",
        "0x5f83",
        "0x5fc0",
        "0x5fe8",
        "0x6010",
        "0x6060",
        "0x609a",
        "0x60b0",
        "0x60c0",
        "0x60d8",
        "0x611a",
        "0x615a",
        "0x619a",
        "0x61da"
      ],
      "kind": "switch",
      "confidence": "exact"
    }
  ]
}
