{
  "$schema": "../../schema/jumptable.schema.json",
  "id": "x86/coreutils-9.9-clang-pie-o2-b2sum",
  "arch": "x86",
  "compiler": "clang",
  "optLevel": "O2",
  "imageBase": "0x0",
  "jumpTables": [
    {
      "insAddr": "0x1a56",
      "tableAddress": "0xd030",
      "jumpBase": "0x13000",
      "entrySize": 4,
      "numEntries": 35,
      "targets": [
        "0x1996",
        "0x1a17",
        "0x1a59",
        "0x1a63",
        "0x1a6d",
        "0x1a7d",
        "0x1a86",
        "0x1a90",
        "0x1aaa",
        "0x1ac4",
        "0x1ad0",
        "0x2d4e"
      ],
      "kind": "switch",
      "confidence": "exact"
    },
    {
      "insAddr": "0x8bd7",
      "tableAddress": "0xde44",
      "jumpBase": "0x13000",
      "entrySize": 4,
      "numEntries": 11,
      "targets": [
        "0x8bda",
        "0x8c7a",
        "0x8ceb",
        "0x8d0c",
        "0x8d14",
        "0x8d16",
        "0x8d1c",
        "0x8d2c",
        "0x8d70",
        "0x9713"
      ],
      "kind": "switch",
      "confidence": "exact"
    },
    {
      "insAddr": "0x8eeb",
      "tableAddress": "0xde70",
      "jumpBase": "0x13000",
      "entrySize": 4,
      "numEntries": 127,
      "targets": [
        "0x8eee",
        "0x8fa0",
        "0x8fd2",
        "0x8fe1",
        "0x8fe3",
        "0x8ff7",
        "0x901c",
        "0x9023",
        "0x9027",
        "0x902e",
        "0x9030",
        "0x9042",
        "0x90b1",
        "0x90e5",
        "0x90ec",
        "0x916f",
        "0x91d5"
      ],
      "kind": "switch",
      "confidence": "exact"
    },
    {
      "insAddr": "0x95e7",
      "tableAddress": "0xe06c",
      "jumpBase": "0x13000",
      "entrySize": 4,
      "numEntries": 34,
      "targets": [
        "0x95c3",
        "0x97d4"
      ],
      "kind": "switch",
      "confidence": "exact"
    },
    {
      "insAddr": "0xa3fb",
      "tableAddress": "0xe178",
      "jumpBase": "0x13000",
      "entrySize": 4,
      "numEntries": 10,
      "targets": [
        "0xa3fe",
        "0xa406",
        "0xa41d",
        "0xa444",
        "0xa44f",
        "0xa467",
        "0xa493",
        "0xa4ad",
        "0xa4df",
        "0xa525"
      ],
      "kind": "switch",
      "confidence": "exact"
    },
    {
      "insAddr": "0xb133",
      "tableAddress": "0xe4c4",
      "jumpBase": "0x13000",
      "entrySize": 4,
      "numEntries": 48,
      "targets": [
        "0xb136",
        "0xb1a8"
      ],
      "kind": "switch",
      "confidence": "exact"
    },
    {
      "insAddr": "0xb1c2",
      "tableAddress": "0xe584",
      "jumpBase": "0x13000",
      "entrySize": 4,
      "numEntries": 54,
      "targets": [
        "0xb1c5",
        "0xb241",
        "0xb2a7",
        "0xb352",
        "0xb387",
        "0xb41c",
        "0xb439",
        "0xb4ce",
        "0xb523",
        "0xb537",
        "0xb655",
        "0xb759",
        "0xb817",
        "0xb83b",
        "0xb862"
      ],
      "kind": "switch",
      "confidence": "exact"
    },
    {
      "insAddr": "0xb8fe",
      "tableAddress": "0xe65c",
      "jumpBase": "0x13000",
      "entrySize": 4,
      "numEntries": 24,
      "targets": [
        "0xb901",
        "0xb93e",
        "0xb95c",
        "0xb966",
        "0xb983",
        "0xb998",
        "0xb9b2"
      ],
      "kind": "switch",
      "confidence": "exact"
    }
  ]
}
