{
  "$schema": "../../schema/jumptable.schema.json",
  "id": "x86/coreutils-8.30-gcc-pie-o2-realpath",
  "arch": "x86",
  "compiler": "gcc",
  "optLevel": "O2",
  "imageBase": "0x0",
  "jumpTables": [
    {
      "insAddr": "0x3a80",
      "tableAddress": "0x7220",
      "jumpBase": "0xbee4",
      "entrySize": 4,
      "numEntries": 11,
      "targets": [
        "0x3a82",
        "0x3fda",
        "0x4040",
        "0x4098",
        "0x40e1",
        "0x4119",
        "0x41bd",
        "0x41f5",
        "0x4958"
      ],
      "kind": "switch",
      "confidence": "exact"
    },
    {
      "insAddr": "0x3bb6",
      "tableAddress": "0x724c",
      "jumpBase": "0xbee4",
      "entrySize": 4,
      "numEntries": 127,
      "targets": [
        "0x3bc5",
        "0x3c9d",
        "0x3cdd",
        "0x3d08",
        "0x3d50",
        "0x3d60",
        "0x3e10",
        "0x3e38",
        "0x3e50",
        "0x3e68",
        "0x3f10",
        "0x3f28",
        "0x3f40",
        "0x3f50",
        "0x3f60",
        "0x3f70",
        "0x3f88"
      ],
      "kind": "switch",
      "confidence": "exact"
    },
    {
      "insAddr": "0x4240",
      "tableAddress": "0x7448",
      "jumpBase": "0xbee4",
      "entrySize": 4,
      "numEntries": 127,
      "targets": [
        "0x3bc0",
        "0x3c98",
        "0x3cd8",
        "0x3f80",
        "0x4248",
        "0x4270",
        "0x4288",
        "0x42a0",
        "0x42b0",
        "0x4360",
        "0x4378",
        "0x4388",
        "0x43a0",
        "0x43c0",
        "0x43e0",
        "0x43f0",
        "0x4418"
      ],
      "kind": "switch",
      "confidence": "exact"
    },
    {
      "insAddr": "0x483b",
      "tableAddress": "0x7644",
      "jumpBase": "0xbee4",
      "entrySize": 4,
      "numEntries": 34,
      "targets": [
        "0x4840",
        "0x4850"
      ],
      "kind": "switch",
      "confidence": "exact"
    },
    {
      "insAddr": "0x5a20",
      "tableAddress": "0x79ec",
      "jumpBase": "0xbee4",
      "entrySize": 4,
      "numEntries": 10,
      "targets": [
        "0x5a38",
        "0x5ab0",
        "0x5b30",
        "0x5b60",
        "0x5b90",
        "0x5bc0",
        "0x5c00",
        "0x5c58",
        "0x5cb0",
        "0x5d56"
      ],
      "kind": "switch",
      "confidence": "exact"
    }
  ]
}
