{
  "$schema": "../../schema/jumptable.schema.json",
  "id": "x64-gcc/coreutils-9.9-gcc-pie-o2-cut",
  "arch": "x64",
  "compiler": "gcc",
  "optLevel": "O2",
  "imageBase": "0x0",
  "jumpTables": [
    {
      "insAddr": "0x282b",
      "tableAddress": "0x99d8",
      "jumpBase": "0x99d8",
      "entrySize": 4,
      "numEntries": 32,
      "targets": [
        "0x27e0",
        "0x282d",
        "0x2833",
        "0x2848",
        "0x2858",
        "0x2890",
        "0x28c0",
        "0x28d0",
        "0x2aa3"
      ],
      "kind": "switch",
      "confidence": "exact"
    },
    {
      "insAddr": "0x4b8e",
      "tableAddress": "0x9ca0",
      "jumpBase": "0x9ca0",
      "entrySize": 4,
      "numEntries": 11,
      "targets": [
        "0x4b90",
        "0x4c1d",
        "0x5128",
        "0x5187",
        "0x51ce",
        "0x5210",
        "0x5267",
        "0x527c",
        "0x52a9"
      ],
      "kind": "switch",
      "confidence": "exact"
    },
    {
      "insAddr": "0x4cc8",
      "tableAddress": "0x9ccc",
      "jumpBase": "0x9ccc",
      "entrySize": 4,
      "numEntries": 36,
      "targets": [
        "0x4ce0",
        "0x4ee0",
        "0x4f10",
        "0x4f60",
        "0x4f98",
        "0x4fd8",
        "0x5010",
        "0x5090",
        "0x50b0",
        "0x50c8",
        "0x50e0",
        "0x5118"
      ],
      "kind": "switch",
      "confidence": "exact"
    },
    {
      "insAddr": "0x545a",
      "tableAddress": "0x9d5c",
      "jumpBase": "0x9d5c",
      "entrySize": 4,
      "numEntries": 36,
      "targets": [
        "0x5460",
        "0x55a8",
        "0x55b5",
        "0x55ca",
        "0x55da",
        "0x55ef",
        "0x5621",
        "0x5698",
        "0x56d1",
        "0x56e3",
        "0x56ff",
        "0x5714"
      ],
      "kind": "switch",
      "confidence": "exact"
    },
    {
      "insAddr": "0x575b",
      "tableAddress": "0x9dec",
      "jumpBase": "0x9dec",
      "entrySize": 4,
      "numEntries": 36,
      "targets": [
        "0x4ce0",
        "0x4ee0",
        "0x5760",
        "0x57e9",
        "0x5817",
        "0x582e",
        "0x5840",
        "0x5857",
        "0x5866",
        "0x586e",
        "0x5880",
        "0x588d"
      ],
      "kind": "switch",
      "confidence": "exact"
    },
    {
      "insAddr": "0x7064",
      "tableAddress": "0xa1e0",
      "jumpBase": "0xa1e0",
      "entrySize": 4,
      "numEntries": 10,
      "targets": [
        "0x7070",
        "0x70a8",
        "0x70d0",
        "0x7100",
        "0x7120",
        "0x7148",
        "0x7170",
        "0x71a0",
        "0x71c0",
        "0x7200"
      ],
      "kind": "switch",
      "confidence": "exact"
    },
    {
      "insAddr": "0x7951",
      "tableAddress": "0xa260",
      "jumpBase": "0xa260",
      "entrySize": 4,
      "numEntries": 24,
      "targets": [
        "0x7958",
        "0x7a10",
        "0x7a58",
        "0x7a80",
        "0x7aa0",
        "0x7ab8",
        "0x7ad8"
      ],
      "kind": "switch",
      "confidence": "exact"
    }
  ]
}
