{
  "$schema": "../../schema/jumptable.schema.json",
  "id": "x64/coreutils-8.30-gcc-pie-o2-base64",
  "arch": "x64",
  "compiler": "gcc",
  "optLevel": "O2",
  "imageBase": "0x0",
  "jumpTables": [
    {
      "insAddr": "0x3001",
      "tableAddress": "0x63a0",
      "jumpBase": "0x63a0",
      "entrySize": 4,
      "numEntries": 11,
      "targets": [
        "0x3003",
        "0x3bd4",
        "0x3c30",
        "0x3c85",
        "0x3cca",
        "0x3d04",
        "0x3daa",
        "0x3de4",
        "0x3fd8"
      ],
      "kind": "switch",
      "confidence": "exact"
    },
    {
      "insAddr": "0x315e",
      "tableAddress": "0x63cc",
      "jumpBase": "0x63cc",
      "entrySize": 4,
      "numEntries": 127,
      "targets": [
        "0x3163",
        "0x3233",
        "0x3263",
        "0x3288",
        "0x32c8",
        "0x32d8",
        "0x3380",
        "0x33a8",
        "0x33c0",
        "0x33d0",
        "0x3400",
        "0x3410",
        "0x3420",
        "0x3430",
        "0x3440",
        "0x3450",
        "0x3468"
      ],
      "kind": "switch",
      "confidence": "exact"
    },
    {
      "insAddr": "0x34ea",
      "tableAddress": "0x65c8",
      "jumpBase": "0x65c8",
      "entrySize": 4,
      "numEntries": 127,
      "targets": [
        "0x3160",
        "0x3230",
        "0x3260",
        "0x3460",
        "0x34f0",
        "0x3510",
        "0x3528",
        "0x3540",
        "0x3550",
        "0x35f0",
        "0x3608",
        "0x3620",
        "0x3638",
        "0x3650",
        "0x3668",
        "0x3678",
        "0x3690"
      ],
      "kind": "switch",
      "confidence": "exact"
    },
    {
      "insAddr": "0x4b64",
      "tableAddress": "0x6b04",
      "jumpBase": "0x6b04",
      "entrySize": 4,
      "numEntries": 10,
      "targets": [
        "0x4b90",
        "0x4c18",
        "0x4c70",
        "0x4cb0",
        "0x4cf0",
        "0x4d40",
        "0x4d98",
        "0x4dc8",
        "0x4e30",
        "0x4ec7"
      ],
      "kind": "switch",
      "confidence": "exact"
    },
    {
      "insAddr": "0x5646",
      "tableAddress": "0x6bd0",
      "jumpBase": "0x6bd0",
      "entrySize": 4,
      "numEntries": 54,
      "targets": [
        "0x5648",
        "0x5670",
        "0x568c",
        "0x5697",
        "0x56ad",
        "0x56c4",
        "0x56ea",
        "0x570f",
        "0x572f",
        "0x5750",
        "0x5773",
        "0x5796",
        "0x57ac"
      ],
      "kind": "switch",
      "confidence": "exact"
    }
  ]
}
