{
  "$schema": "../../schema/jumptable.schema.json",
  "id": "x86/coreutils-9.9-gcc-pie-o2-echo",
  "arch": "x86",
  "compiler": "gcc",
  "optLevel": "O2",
  "imageBase": "0x0",
  "jumpTables": [
    {
      "insAddr": "0x18fc",
      "tableAddress": "0x60a0",
      "jumpBase": "0xa000",
      "entrySize": 4,
      "numEntries": 73,
      "targets": [
        "0x17eb",
        "0x18fe",
        "0x1916",
        "0x1942",
        "0x195a",
        "0x19a6",
        "0x19c0",
        "0x19da",
        "0x19f4",
        "0x1a0e",
        "0x1a28",
        "0x1a42",
        "0x1b7c",
        "0x1b96"
      ],
      "kind": "switch",
      "confidence": "exact"
    },
    {
      "insAddr": "0x1dbd",
      "tableAddress": "0x6008",
      "jumpBase": "0xa000",
      "entrySize": 4,
      "numEntries": 38,
      "targets": [
        "0x1dc0",
        "0x1dd0",
        "0x1de0",
        "0x1df0",
        "0x1e00",
        "0x1e10",
        "0x1e20"
      ],
      "kind": "switch",
      "confidence": "exact"
    },
    {
      "insAddr": "0x2454",
      "tableAddress": "0x6880",
      "jumpBase": "0xa000",
      "entrySize": 4,
      "numEntries": 11,
      "targets": [
        "0x2460",
        "0x24fc",
        "0x2a4f",
        "0x2ab3",
        "0x2b01",
        "0x2b45",
        "0x2b98",
        "0x2bad",
        "0x2be2"
      ],
      "kind": "switch",
      "confidence": "exact"
    },
    {
      "insAddr": "0x25a0",
      "tableAddress": "0x68ac",
      "jumpBase": "0xa000",
      "entrySize": 4,
      "numEntries": 36,
      "targets": [
        "0x25a8",
        "0x2718",
        "0x2750",
        "0x27b0",
        "0x27f0",
        "0x2838",
        "0x2878",
        "0x2908",
        "0x2930",
        "0x2950",
        "0x2970",
        "0x2990"
      ],
      "kind": "switch",
      "confidence": "exact"
    },
    {
      "insAddr": "0x2d9b",
      "tableAddress": "0x693c",
      "jumpBase": "0xa000",
      "entrySize": 4,
      "numEntries": 36,
      "targets": [
        "0x2da0",
        "0x2e7a",
        "0x2e8a",
        "0x2ea2",
        "0x2eb5",
        "0x2ec8",
        "0x2ee0",
        "0x2f15",
        "0x2f90",
        "0x2fd7",
        "0x2ff3",
        "0x300b"
      ],
      "kind": "switch",
      "confidence": "exact"
    },
    {
      "insAddr": "0x3051",
      "tableAddress": "0x69cc",
      "jumpBase": "0xa000",
      "entrySize": 4,
      "numEntries": 36,
      "targets": [
        "0x25b0",
        "0x2720",
        "0x305c",
        "0x30e8",
        "0x30ff",
        "0x3116",
        "0x312a",
        "0x3141",
        "0x3155",
        "0x3164",
        "0x3178",
        "0x318c"
      ],
      "kind": "switch",
      "confidence": "exact"
    },
    {
      "insAddr": "0x31eb",
      "tableAddress": "0x6a5c",
      "jumpBase": "0xa000",
      "entrySize": 4,
      "numEntries": 30,
      "targets": [
        "0x2720",
        "0x31a8",
        "0x31ed",
        "0x3226"
      ],
      "kind": "switch",
      "confidence": "exact"
    },
    {
      "insAddr": "0x3405",
      "tableAddress": "0x6ad4",
      "jumpBase": "0xa000",
      "entrySize": 4,
      "numEntries": 4,
      "targets": [
        "0x2720",
        "0x31ed",
        "0x3221"
      ],
      "kind": "switch",
      "confidence": "exact"
    },
    {
      "insAddr": "0x3871",
      "tableAddress": "0x6ae4",
      "jumpBase": "0xa000",
      "entrySize": 4,
      "numEntries": 4,
      "targets": [
        "0x2e7a",
        "0x3873",
        "0x3881"
      ],
      "kind": "switch",
      "confidence": "exact"
    },
    {
      "insAddr": "0x4b26",
      "tableAddress": "0x6e28",
      "jumpBase": "0xa000",
      "entrySize": 4,
      "numEntries": 10,
      "targets": [
        "0x4b30",
        "0x4b5c",
        "0x4b70",
        "0x4b98",
        "0x4bb0",
        "0x4bd0",
        "0x4be8",
        "0x4c00",
        "0x4c20",
        "0x4c40"
      ],
      "kind": "switch",
      "confidence": "exact"
    }
  ]
}
