{
  "$schema": "../../schema/jumptable.schema.json",
  "id": "x64-gcc/coreutils-9.9-gcc-pie-o2-ginstall",
  "arch": "x64",
  "compiler": "gcc",
  "optLevel": "O2",
  "imageBase": "0x0",
  "jumpTables": [
    {
      "insAddr": "0x3c91",
      "tableAddress": "0x17378",
      "jumpBase": "0x17378",
      "entrySize": 4,
      "numEntries": 64,
      "targets": [
        "0x3c50",
        "0x3cf6",
        "0x3d3f",
        "0x3d5c",
        "0x3d7a",
        "0x3d89",
        "0x3d93",
        "0x3da8",
        "0x3dc0",
        "0x3dca",
        "0x3ddd",
        "0x3dee",
        "0x3e01",
        "0x3e0d",
        "0x3e2b",
        "0x3e53",
        "0x3e6a",
        "0x3ead",
        "0x3eb7"
      ],
      "kind": "switch",
      "confidence": "exact"
    },
    {
      "insAddr": "0x91f2",
      "tableAddress": "0x17e90",
      "jumpBase": "0x17e90",
      "entrySize": 4,
      "numEntries": 5,
      "targets": [
        "0x91f4",
        "0x9283",
        "0x928f",
        "0x929b",
        "0x92a7"
      ],
      "kind": "switch",
      "confidence": "exact"
    },
    {
      "insAddr": "0x920f",
      "tableAddress": "0x17ea4",
      "jumpBase": "0x17ea4",
      "entrySize": 4,
      "numEntries": 7,
      "targets": [
        "0x9211",
        "0x9268",
        "0x9271",
        "0x927a",
        "0x92bf"
      ],
      "kind": "switch",
      "confidence": "exact"
    },
    {
      "insAddr": "0x922c",
      "tableAddress": "0x17ec0",
      "jumpBase": "0x17ec0",
      "entrySize": 4,
      "numEntries": 7,
      "targets": [
        "0x922e",
        "0x924d",
        "0x9256",
        "0x925f",
        "0x92b3"
      ],
      "kind": "switch",
      "confidence": "exact"
    },
    {
      "insAddr": "0xeea1",
      "tableAddress": "0x1814c",
      "jumpBase": "0x1814c",
      "entrySize": 4,
      "numEntries": 33,
      "targets": [
        "0xeec0",
        "0xeee0",
        "0xef00",
        "0xef10",
        "0xef20",
        "0xef30",
        "0xf010"
      ],
      "kind": "switch",
      "confidence": "exact"
    },
    {
      "insAddr": "0xf62e",
      "tableAddress": "0x18240",
      "jumpBase": "0x18240",
      "entrySize": 4,
      "numEntries": 11,
      "targets": [
        "0xf630",
        "0xf6bd",
        "0xfbc8",
        "0xfc27",
        "0xfc6e",
        "0xfcb0",
        "0xfd07",
        "0xfd1c",
        "0xfd49"
      ],
      "kind": "switch",
      "confidence": "exact"
    },
    {
      "insAddr": "0xf768",
      "tableAddress": "0x1826c",
      "jumpBase": "0x1826c",
      "entrySize": 4,
      "numEntries": 36,
      "targets": [
        "0xf780",
        "0xf980",
        "0xf9b0",
        "0xfa00",
        "0xfa38",
        "0xfa78",
        "0xfab0",
        "0xfb30",
        "0xfb50",
        "0xfb68",
        "0xfb80",
        "0xfbb8"
      ],
      "kind": "switch",
      "confidence": "exact"
    },
    {
      "insAddr": "0xfefa",
      "tableAddress": "0x182fc",
      "jumpBase": "0x182fc",
      "entrySize": 4,
      "numEntries": 36,
      "targets": [
        "0xff00",
        "0x10048",
        "0x10055",
        "0x1006a",
        "0x1007a",
        "0x1008f",
        "0x100c1",
        "0x10138",
        "0x10171",
        "0x10183",
        "0x1019f",
        "0x101b4"
      ],
      "kind": "switch",
      "confidence": "exact"
    },
    {
      "insAddr": "0x101fb",
      "tableAddress": "0x1838c",
      "jumpBase": "0x1838c",
      "entrySize": 4,
      "numEntries": 36,
      "targets": [
        "0xf780",
        "0xf980",
        "0x10200",
        "0x10289",
        "0x102b7",
        "0x102ce",
        "0x102e0",
        "0x102f7",
        "0x10306",
        "0x1030e",
        "0x10320",
        "0x1032d"
      ],
      "kind": "switch",
      "confidence": "exact"
    },
    {
      "insAddr": "0x13654",
      "tableAddress": "0x18880",
      "jumpBase": "0x18880",
      "entrySize": 4,
      "numEntries": 10,
      "targets": [
        "0x13660",
        "0x13698",
        "0x136c0",
        "0x136f0",
        "0x13710",
        "0x13738",
        "0x13760",
        "0x13790",
        "0x137b0",
        "0x137f0"
      ],
      "kind": "switch",
      "confidence": "exact"
    },
    {
      "insAddr": "0x140f3",
      "tableAddress": "0x18900",
      "jumpBase": "0x18900",
      "entrySize": 4,
      "numEntries": 54,
      "targets": [
        "0x14115",
        "0x14129",
        "0x14157",
        "0x14188",
        "0x141c4",
        "0x141f6",
        "0x14209",
        "0x14228",
        "0x14235",
        "0x14247",
        "0x14259",
        "0x14289",
        "0x142b9",
        "0x142e9",
        "0x14319"
      ],
      "kind": "switch",
      "confidence": "exact"
    }
  ]
}
