{
  "$schema": "../../schema/jumptable.schema.json",
  "id": "x86-gcc/coreutils-9.9-gcc-pie-o2-cksum",
  "arch": "x86",
  "compiler": "gcc",
  "optLevel": "O2",
  "imageBase": "0x0",
  "jumpTables": [
    {
      "insAddr": "0x28ed",
      "tableAddress": "0x28260",
      "jumpBase": "0x34000",
      "entrySize": 4,
      "numEntries": 40,
      "targets": [
        "0x28ef",
        "0x28fb",
        "0x2950",
        "0x295c",
        "0x2968",
        "0x2974",
        "0x2983",
        "0x2992",
        "0x299e",
        "0x29b8",
        "0x29d2",
        "0x29de",
        "0x29ea",
        "0x2a04",
        "0x2a57",
        "0x2ad9",
        "0x41c7"
      ],
      "kind": "switch",
      "confidence": "exact"
    },
    {
      "insAddr": "0x506c",
      "tableAddress": "0x2da50",
      "jumpBase": "0x34000",
      "entrySize": 4,
      "numEntries": 109,
      "targets": [
        "0x4f29",
        "0x5233",
        "0x524e",
        "0x525d",
        "0x5278",
        "0x5287",
        "0x52a2",
        "0x52bd",
        "0x52d8",
        "0x52e7",
        "0x5302",
        "0x531d",
        "0x5338",
        "0x5353",
        "0x537a",
        "0x5389",
        "0x53a4",
        "0x53bc",
        "0x53d7",
        "0x53e6"
      ],
      "kind": "switch",
      "confidence": "exact"
    },
    {
      "insAddr": "0x5513",
      "tableAddress": "0x2dc04",
      "jumpBase": "0x34000",
      "entrySize": 4,
      "numEntries": 11,
      "targets": [
        "0x4fa4",
        "0x5516",
        "0x5587",
        "0x55d7",
        "0x5602",
        "0x5611",
        "0x5645",
        "0x5684"
      ],
      "kind": "switch",
      "confidence": "exact"
    },
    {
      "insAddr": "0x572b",
      "tableAddress": "0x2dc30",
      "jumpBase": "0x34000",
      "entrySize": 4,
      "numEntries": 19,
      "targets": [
        "0x4f29",
        "0x524e",
        "0x572e",
        "0x5749",
        "0x5768",
        "0x5777"
      ],
      "kind": "switch",
      "confidence": "exact"
    },
    {
      "insAddr": "0x20b14",
      "tableAddress": "0x2d1a0",
      "jumpBase": "0x34000",
      "entrySize": 4,
      "numEntries": 11,
      "targets": [
        "0x20b20",
        "0x20bbc",
        "0x2110f",
        "0x21173",
        "0x211c1",
        "0x21205",
        "0x21258",
        "0x2126d",
        "0x212a2"
      ],
      "kind": "switch",
      "confidence": "exact"
    },
    {
      "insAddr": "0x20c60",
      "tableAddress": "0x2d1cc",
      "jumpBase": "0x34000",
      "entrySize": 4,
      "numEntries": 36,
      "targets": [
        "0x20c68",
        "0x20dd8",
        "0x20e10",
        "0x20e70",
        "0x20eb0",
        "0x20ef8",
        "0x20f38",
        "0x20fc8",
        "0x20ff0",
        "0x21010",
        "0x21030",
        "0x21050"
      ],
      "kind": "switch",
      "confidence": "exact"
    },
    {
      "insAddr": "0x2145b",
      "tableAddress": "0x2d25c",
      "jumpBase": "0x34000",
      "entrySize": 4,
      "numEntries": 36,
      "targets": [
        "0x21460",
        "0x2153a",
        "0x2154a",
        "0x21562",
        "0x21575",
        "0x21588",
        "0x215a0",
        "0x215d5",
        "0x21650",
        "0x21697",
        "0x216b3",
        "0x216cb"
      ],
      "kind": "switch",
      "confidence": "exact"
    },
    {
      "insAddr": "0x21711",
      "tableAddress": "0x2d2ec",
      "jumpBase": "0x34000",
      "entrySize": 4,
      "numEntries": 36,
      "targets": [
        "0x20c70",
        "0x20de0",
        "0x2171c",
        "0x217a8",
        "0x217bf",
        "0x217d6",
        "0x217ea",
        "0x21801",
        "0x21815",
        "0x21824",
        "0x21838",
        "0x2184c"
      ],
      "kind": "switch",
      "confidence": "exact"
    },
    {
      "insAddr": "0x218ab",
      "tableAddress": "0x2d37c",
      "jumpBase": "0x34000",
      "entrySize": 4,
      "numEntries": 30,
      "targets": [
        "0x20de0",
        "0x21868",
        "0x218ad",
        "0x218e6"
      ],
      "kind": "switch",
      "confidence": "exact"
    },
    {
      "insAddr": "0x21ac5",
      "tableAddress": "0x2d3f4",
      "jumpBase": "0x34000",
      "entrySize": 4,
      "numEntries": 4,
      "targets": [
        "0x20de0",
        "0x218ad",
        "0x218e1"
      ],
      "kind": "switch",
      "confidence": "exact"
    },
    {
      "insAddr": "0x21f31",
      "tableAddress": "0x2d404",
      "jumpBase": "0x34000",
      "entrySize": 4,
      "numEntries": 4,
      "targets": [
        "0x2153a",
        "0x21f33",
        "0x21f41"
      ],
      "kind": "switch",
      "confidence": "exact"
    },
    {
      "insAddr": "0x23206",
      "tableAddress": "0x2d748",
      "jumpBase": "0x34000",
      "entrySize": 4,
      "numEntries": 10,
      "targets": [
        "0x23210",
        "0x2323c",
        "0x23250",
        "0x23278",
        "0x23290",
        "0x232b0",
        "0x232c8",
        "0x232e0",
        "0x23300",
        "0x23320"
      ],
      "kind": "switch",
      "confidence": "exact"
    },
    {
      "insAddr": "0x23e85",
      "tableAddress": "0x2d7c0",
      "jumpBase": "0x34000",
      "entrySize": 4,
      "numEntries": 54,
      "targets": [
        "0x23e87",
        "0x23f94",
        "0x24008",
        "0x24041",
        "0x24079",
        "0x24149",
        "0x24193",
        "0x241bb",
        "0x241e6",
        "0x24211",
        "0x24272",
        "0x242d2",
        "0x24332",
        "0x24392",
        "0x243f2"
      ],
      "kind": "switch",
      "confidence": "exact"
    },
    {
      "insAddr": "0x24b63",
      "tableAddress": "0x2d898",
      "jumpBase": "0x34000",
      "entrySize": 4,
      "numEntries": 24,
      "targets": [
        "0x24b68",
        "0x24c10",
        "0x24c50",
        "0x24c70",
        "0x24c88",
        "0x24c98",
        "0x24cb0"
      ],
      "kind": "switch",
      "confidence": "exact"
    }
  ]
}
