{
  "$schema": "../../schema/jumptable.schema.json",
  "id": "x64-clang/coreutils-9.9-clang-pie-o2-fmt",
  "arch": "x64",
  "compiler": "clang",
  "optLevel": "O2",
  "imageBase": "0x0",
  "jumpTables": [
    {
      "insAddr": "0x296f",
      "tableAddress": "0x7004",
      "jumpBase": "0x7004",
      "entrySize": 4,
      "numEntries": 21,
      "targets": [
        "0x2930",
        "0x2972",
        "0x297b",
        "0x29f5",
        "0x2a01",
        "0x2a0d",
        "0x2a21",
        "0x2c88"
      ],
      "kind": "switch",
      "confidence": "exact"
    },
    {
      "insAddr": "0x43d4",
      "tableAddress": "0x76b0",
      "jumpBase": "0x76b0",
      "entrySize": 4,
      "numEntries": 11,
      "targets": [
        "0x43d7",
        "0x447c",
        "0x44db",
        "0x44fa",
        "0x4503",
        "0x4505",
        "0x4507",
        "0x4515",
        "0x4562",
        "0x4ed2"
      ],
      "kind": "switch",
      "confidence": "exact"
    },
    {
      "insAddr": "0x469d",
      "tableAddress": "0x76dc",
      "jumpBase": "0x76dc",
      "entrySize": 4,
      "numEntries": 127,
      "targets": [
        "0x46a1",
        "0x4731",
        "0x475a",
        "0x4768",
        "0x476b",
        "0x4780",
        "0x47a3",
        "0x47aa",
        "0x47af",
        "0x47b6",
        "0x47b9",
        "0x47cc",
        "0x48a0",
        "0x48d3",
        "0x48da",
        "0x496b",
        "0x49e4"
      ],
      "kind": "switch",
      "confidence": "exact"
    },
    {
      "insAddr": "0x5a8b",
      "tableAddress": "0x7960",
      "jumpBase": "0x7960",
      "entrySize": 4,
      "numEntries": 10,
      "targets": [
        "0x5a8e",
        "0x5ab2",
        "0x5ad1",
        "0x5b05",
        "0x5b2d",
        "0x5b59",
        "0x5b83",
        "0x5ba3",
        "0x5bfa",
        "0x5c37"
      ],
      "kind": "switch",
      "confidence": "exact"
    },
    {
      "insAddr": "0x6782",
      "tableAddress": "0x7cb0",
      "jumpBase": "0x7cb0",
      "entrySize": 4,
      "numEntries": 54,
      "targets": [
        "0x6785",
        "0x67ca",
        "0x67e4",
        "0x6843",
        "0x6866",
        "0x68ab",
        "0x68c4",
        "0x6909",
        "0x6990",
        "0x69a0",
        "0x6a4c",
        "0x6aea",
        "0x6b5a",
        "0x6b78",
        "0x6b98"
      ],
      "kind": "switch",
      "confidence": "exact"
    },
    {
      "insAddr": "0x6c1a",
      "tableAddress": "0x7d88",
      "jumpBase": "0x7d88",
      "entrySize": 4,
      "numEntries": 24,
      "targets": [
        "0x6bf4",
        "0x6c1d",
        "0x6c5c",
        "0x6c7c",
        "0x6c9a",
        "0x6cb5",
        "0x6cc4"
      ],
      "kind": "switch",
      "confidence": "exact"
    }
  ]
}
