{
  "$schema": "../../schema/jumptable.schema.json",
  "id": "x86/coreutils-9.9-gcc-pie-o2-nl",
  "arch": "x86",
  "compiler": "gcc",
  "optLevel": "O2",
  "imageBase": "0x0",
  "jumpTables": [
    {
      "insAddr": "0x27af",
      "tableAddress": "0x9acc",
      "jumpBase": "0xe000",
      "entrySize": 4,
      "numEntries": 22,
      "targets": [
        "0x27c0",
        "0x27d0",
        "0x2810",
        "0x2850",
        "0x2868",
        "0x2878",
        "0x28d0",
        "0x2910",
        "0x2950",
        "0x2990",
        "0x29d0",
        "0x2a08"
      ],
      "kind": "switch",
      "confidence": "exact"
    },
    {
      "insAddr": "0x3f34",
      "tableAddress": "0x9c00",
      "jumpBase": "0xe000",
      "entrySize": 4,
      "numEntries": 11,
      "targets": [
        "0x3f40",
        "0x3fdc",
        "0x452f",
        "0x4593",
        "0x45e1",
        "0x4625",
        "0x4678",
        "0x468d",
        "0x46c2"
      ],
      "kind": "switch",
      "confidence": "exact"
    },
    {
      "insAddr": "0x4080",
      "tableAddress": "0x9c2c",
      "jumpBase": "0xe000",
      "entrySize": 4,
      "numEntries": 36,
      "targets": [
        "0x4088",
        "0x41f8",
        "0x4230",
        "0x4290",
        "0x42d0",
        "0x4318",
        "0x4358",
        "0x43e8",
        "0x4410",
        "0x4430",
        "0x4450",
        "0x4470"
      ],
      "kind": "switch",
      "confidence": "exact"
    },
    {
      "insAddr": "0x487b",
      "tableAddress": "0x9cbc",
      "jumpBase": "0xe000",
      "entrySize": 4,
      "numEntries": 36,
      "targets": [
        "0x4880",
        "0x495a",
        "0x496a",
        "0x4982",
        "0x4995",
        "0x49a8",
        "0x49c0",
        "0x49f5",
        "0x4a70",
        "0x4ab7",
        "0x4ad3",
        "0x4aeb"
      ],
      "kind": "switch",
      "confidence": "exact"
    },
    {
      "insAddr": "0x4b31",
      "tableAddress": "0x9d4c",
      "jumpBase": "0xe000",
      "entrySize": 4,
      "numEntries": 36,
      "targets": [
        "0x4090",
        "0x4200",
        "0x4b3c",
        "0x4bc8",
        "0x4bdf",
        "0x4bf6",
        "0x4c0a",
        "0x4c21",
        "0x4c35",
        "0x4c44",
        "0x4c58",
        "0x4c6c"
      ],
      "kind": "switch",
      "confidence": "exact"
    },
    {
      "insAddr": "0x4ccb",
      "tableAddress": "0x9ddc",
      "jumpBase": "0xe000",
      "entrySize": 4,
      "numEntries": 30,
      "targets": [
        "0x4200",
        "0x4c88",
        "0x4ccd",
        "0x4d06"
      ],
      "kind": "switch",
      "confidence": "exact"
    },
    {
      "insAddr": "0x4ee5",
      "tableAddress": "0x9e54",
      "jumpBase": "0xe000",
      "entrySize": 4,
      "numEntries": 4,
      "targets": [
        "0x4200",
        "0x4ccd",
        "0x4d01"
      ],
      "kind": "switch",
      "confidence": "exact"
    },
    {
      "insAddr": "0x5351",
      "tableAddress": "0x9e64",
      "jumpBase": "0xe000",
      "entrySize": 4,
      "numEntries": 4,
      "targets": [
        "0x495a",
        "0x5353",
        "0x5361"
      ],
      "kind": "switch",
      "confidence": "exact"
    },
    {
      "insAddr": "0x6606",
      "tableAddress": "0xa1a8",
      "jumpBase": "0xe000",
      "entrySize": 4,
      "numEntries": 10,
      "targets": [
        "0x6610",
        "0x663c",
        "0x6650",
        "0x6678",
        "0x6690",
        "0x66b0",
        "0x66c8",
        "0x66e0",
        "0x6700",
        "0x6720"
      ],
      "kind": "switch",
      "confidence": "exact"
    },
    {
      "insAddr": "0x7296",
      "tableAddress": "0xa220",
      "jumpBase": "0xe000",
      "entrySize": 4,
      "numEntries": 54,
      "targets": [
        "0x72bb",
        "0x7360",
        "0x73a8",
        "0x7420",
        "0x7480",
        "0x74f8",
        "0x756d",
        "0x75a0",
        "0x75c3",
        "0x75e6",
        "0x766e",
        "0x76f6",
        "0x777e",
        "0x7806",
        "0x788e"
      ],
      "kind": "switch",
      "confidence": "exact"
    },
    {
      "insAddr": "0x8133",
      "tableAddress": "0xa2f8",
      "jumpBase": "0xe000",
      "entrySize": 4,
      "numEntries": 24,
      "targets": [
        "0x8138",
        "0x81e0",
        "0x8220",
        "0x8240",
        "0x8258",
        "0x8268",
        "0x8280"
      ],
      "kind": "switch",
      "confidence": "exact"
    }
  ]
}
