{
  "$schema": "../../schema/jumptable.schema.json",
  "id": "x64/coreutils-8.30-gcc-pie-o2-mkdir",
  "arch": "x64",
  "compiler": "gcc",
  "optLevel": "O2",
  "imageBase": "0x0",
  "jumpTables": [
    {
      "insAddr": "0x2b94",
      "tableAddress": "0x8adc",
      "jumpBase": "0x8adc",
      "entrySize": 4,
      "numEntries": 33,
      "targets": [
        "0x2ba0",
        "0x2bb9",
        "0x2bd8",
        "0x2be0",
        "0x2bf0",
        "0x2c00",
        "0x2c10"
      ],
      "kind": "switch",
      "confidence": "exact"
    },
    {
      "insAddr": "0x3141",
      "tableAddress": "0x8c20",
      "jumpBase": "0x8c20",
      "entrySize": 4,
      "numEntries": 11,
      "targets": [
        "0x3143",
        "0x3d14",
        "0x3d70",
        "0x3dc5",
        "0x3e0a",
        "0x3e44",
        "0x3eea",
        "0x3f24",
        "0x4118"
      ],
      "kind": "switch",
      "confidence": "exact"
    },
    {
      "insAddr": "0x329e",
      "tableAddress": "0x8c4c",
      "jumpBase": "0x8c4c",
      "entrySize": 4,
      "numEntries": 127,
      "targets": [
        "0x32a3",
        "0x3373",
        "0x33a3",
        "0x33c8",
        "0x3408",
        "0x3418",
        "0x34c0",
        "0x34e8",
        "0x3500",
        "0x3510",
        "0x3540",
        "0x3550",
        "0x3560",
        "0x3570",
        "0x3580",
        "0x3590",
        "0x35a8"
      ],
      "kind": "switch",
      "confidence": "exact"
    },
    {
      "insAddr": "0x362a",
      "tableAddress": "0x8e48",
      "jumpBase": "0x8e48",
      "entrySize": 4,
      "numEntries": 127,
      "targets": [
        "0x32a0",
        "0x3370",
        "0x33a0",
        "0x35a0",
        "0x3630",
        "0x3650",
        "0x3668",
        "0x3680",
        "0x3690",
        "0x3730",
        "0x3748",
        "0x3760",
        "0x3778",
        "0x3790",
        "0x37a8",
        "0x37b8",
        "0x37d0"
      ],
      "kind": "switch",
      "confidence": "exact"
    },
    {
      "insAddr": "0x4d43",
      "tableAddress": "0x90f8",
      "jumpBase": "0x90f8",
      "entrySize": 4,
      "numEntries": 6,
      "targets": [
        "0x4c7f",
        "0x4dd0",
        "0x4de0",
        "0x4e9b"
      ],
      "kind": "switch",
      "confidence": "exact"
    },
    {
      "insAddr": "0x4f14",
      "tableAddress": "0x9110",
      "jumpBase": "0x9110",
      "entrySize": 4,
      "numEntries": 5,
      "targets": [
        "0x4f20",
        "0x4f33",
        "0x4f58",
        "0x4fb0"
      ],
      "kind": "switch",
      "confidence": "exact"
    },
    {
      "insAddr": "0x5059",
      "tableAddress": "0x9124",
      "jumpBase": "0x9124",
      "entrySize": 4,
      "numEntries": 5,
      "targets": [
        "0x5060",
        "0x5068",
        "0x5070"
      ],
      "kind": "switch",
      "confidence": "exact"
    },
    {
      "insAddr": "0x52f4",
      "tableAddress": "0x9470",
      "jumpBase": "0x9470",
      "entrySize": 4,
      "numEntries": 10,
      "targets": [
        "0x5320",
        "0x53a8",
        "0x5400",
        "0x5440",
        "0x5480",
        "0x54d0",
        "0x5528",
        "0x5558",
        "0x55c0",
        "0x5657"
      ],
      "kind": "switch",
      "confidence": "exact"
    },
    {
      "insAddr": "0x684b",
      "tableAddress": "0x94f0",
      "jumpBase": "0x94f0",
      "entrySize": 4,
      "numEntries": 18,
      "targets": [
        "0x6850",
        "0x6988",
        "0x6ab0",
        "0x6b38",
        "0x6bb8",
        "0x6bf8",
        "0x6c80",
        "0x6cb0",
        "0x7216"
      ],
      "kind": "switch",
      "confidence": "exact"
    },
    {
      "insAddr": "0x6df0",
      "tableAddress": "0x9538",
      "jumpBase": "0x9538",
      "entrySize": 4,
      "numEntries": 5,
      "targets": [
        "0x6f30",
        "0x7060",
        "0x7070",
        "0x7080"
      ],
      "kind": "switch",
      "confidence": "exact"
    },
    {
      "insAddr": "0x75a6",
      "tableAddress": "0x9560",
      "jumpBase": "0x9560",
      "entrySize": 4,
      "numEntries": 23,
      "targets": [
        "0x75b0",
        "0x75e0",
        "0x75e6",
        "0x760a",
        "0x762c",
        "0x764e",
        "0x7674",
        "0x76a2",
        "0x76d0"
      ],
      "kind": "switch",
      "confidence": "exact"
    },
    {
      "insAddr": "0x79b5",
      "tableAddress": "0x95dc",
      "jumpBase": "0x95dc",
      "entrySize": 4,
      "numEntries": 84,
      "targets": [
        "0x79b7",
        "0x7a2b",
        "0x7e6c",
        "0x7eb8",
        "0x7ecb",
        "0x7f18",
        "0x7f2b",
        "0x7f4c",
        "0x7f5c",
        "0x7fb0",
        "0x7fbb"
      ],
      "kind": "switch",
      "confidence": "exact"
    }
  ]
}
