{
  "$schema": "../../schema/jumptable.schema.json",
  "id": "x64/coreutils-9.9-clang-pie-o2-basename",
  "arch": "x64",
  "compiler": "clang",
  "optLevel": "O2",
  "imageBase": "0x0",
  "jumpTables": [
    {
      "insAddr": "0x2fe4",
      "tableAddress": "0x6490",
      "jumpBase": "0x6490",
      "entrySize": 4,
      "numEntries": 11,
      "targets": [
        "0x2fe7",
        "0x308c",
        "0x30eb",
        "0x310a",
        "0x3113",
        "0x3115",
        "0x3117",
        "0x3125",
        "0x3172",
        "0x3ae2"
      ],
      "kind": "switch",
      "confidence": "exact"
    },
    {
      "insAddr": "0x32ad",
      "tableAddress": "0x64bc",
      "jumpBase": "0x64bc",
      "entrySize": 4,
      "numEntries": 127,
      "targets": [
        "0x32b1",
        "0x3341",
        "0x336a",
        "0x3378",
        "0x337b",
        "0x3390",
        "0x33b3",
        "0x33ba",
        "0x33bf",
        "0x33c6",
        "0x33c9",
        "0x33dc",
        "0x34b0",
        "0x34e3",
        "0x34ea",
        "0x357b",
        "0x35f4"
      ],
      "kind": "switch",
      "confidence": "exact"
    },
    {
      "insAddr": "0x469b",
      "tableAddress": "0x6744",
      "jumpBase": "0x6744",
      "entrySize": 4,
      "numEntries": 10,
      "targets": [
        "0x469e",
        "0x46c2",
        "0x46e1",
        "0x4715",
        "0x473d",
        "0x4769",
        "0x4793",
        "0x47b3",
        "0x480a",
        "0x4847"
      ],
      "kind": "switch",
      "confidence": "exact"
    }
  ]
}
